{
  "schemaRef": "urn:premise-builder:schema:document:0.1.0",
  "format": "premise-builder",
  "formatVersion": "0.1.0",
  "protocolVersion": "0.1.0",
  "documentType": "base",
  "meta": {
    "documentId": "pb_86666ce3dbb241f19985",
    "projectName": "Premise Builder v0.2 — Japanese Edition",
    "template": {
      "id": "web-small-app",
      "family": "software",
      "version": "0.1.0"
    },
    "contentLanguage": "ja",
    "revision": 1,
    "createdAt": "2026-09-21T12:31:51.980Z",
    "updatedAt": "2026-09-21T15:37:05.280Z"
  },
  "handling": {
    "privacy": "private-by-default",
    "storage": "browser-local-only",
    "networkPolicy": "no-project-data-transmission",
    "aiInterpretation": {
      "governingInstructionPolicy": "never-override-host-instructions",
      "unknownPolicy": "do-not-assume",
      "conflictPolicy": "report-before-dependent-work",
      "proposalPolicy": "requires-human-approval"
    }
  },
  "participants": {
    "participant_3fa593940f374cf2af19": {
      "kind": "individual",
      "label": "Project owner",
      "labelLanguage": "en",
      "roles": [
        "developer",
        "decision_owner"
      ]
    }
  },
  "items": {
    "project.project_kind": {
      "label": "What are you building?",
      "labelLanguage": "en",
      "category": "project.intent",
      "axis": "fact",
      "kind": "decision",
      "scope": "project",
      "enforcement": "soft",
      "priority": "must",
      "contributions": {
        "pbc_b9483a01dd264d6c8a75": {
          "perspectiveRef": "participant_3fa593940f374cf2af19",
          "recordedByRef": "participant_3fa593940f374cf2af19",
          "speakingAs": "developer",
          "captureMethod": "direct_input",
          "authority": "decision_owner",
          "confirmation": "directly_reported",
          "value": "browser_local_utility",
          "recordedAt": "2026-09-21T12:32:55.175Z",
          "note": "Extend the existing Premise Builder with a Japanese interface and Japanese questionnaire content while preserving its browser-local, serverless architecture."
        }
      },
      "resolution": {
        "status": "confirmed",
        "value": "browser_local_utility",
        "decidedByRefs": [
          "participant_3fa593940f374cf2af19"
        ],
        "decisionMethod": "explicit_confirmation",
        "decidedAt": "2026-09-21T12:33:14.988Z"
      },
      "dependencies": [],
      "updatedAt": "2026-09-21T12:34:41.680Z",
      "rationale": "Extend the existing Premise Builder with a Japanese interface and Japanese questionnaire content while preserving its browser-local, serverless architecture."
    },
    "project.primary_outcome": {
      "label": "What is the primary outcome this release should enable?",
      "labelLanguage": "en",
      "category": "project.intent",
      "axis": "fact",
      "kind": "requirement",
      "scope": "project",
      "enforcement": "soft",
      "priority": "must",
      "contributions": {
        "pbc_36249849f4b74cb485af": {
          "perspectiveRef": "participant_3fa593940f374cf2af19",
          "recordedByRef": "participant_3fa593940f374cf2af19",
          "speakingAs": "developer",
          "captureMethod": "direct_input",
          "authority": "decision_owner",
          "confirmation": "directly_reported",
          "value": "complete_workflow",
          "recordedAt": "2026-09-21T12:35:35.154Z",
          "note": "日本語利用者が、プロジェクト作成から前提の入力・確認・確定・エクスポートまでを、一連のワークフローとして完了できることを優先する。"
        }
      },
      "resolution": {
        "status": "confirmed",
        "value": "complete_workflow",
        "decidedByRefs": [
          "participant_3fa593940f374cf2af19"
        ],
        "decisionMethod": "explicit_confirmation",
        "decidedAt": "2026-09-21T12:35:59.212Z"
      },
      "dependencies": [],
      "updatedAt": "2026-09-21T12:40:48.943Z",
      "rationale": "日本語利用者が、プロジェクト作成から前提の入力・確認・確定・エクスポートまでを、一連のワークフローとして完了できることを優先する。"
    },
    "project.current_phase": {
      "label": "What phase is the project in?",
      "labelLanguage": "en",
      "category": "project.intent",
      "axis": "fact",
      "kind": "observation",
      "scope": "project",
      "enforcement": "advisory",
      "priority": "must",
      "contributions": {
        "pbc_de104b69194a473f89b2": {
          "perspectiveRef": "participant_3fa593940f374cf2af19",
          "recordedByRef": "participant_3fa593940f374cf2af19",
          "speakingAs": "developer",
          "captureMethod": "direct_input",
          "authority": "decision_owner",
          "confirmation": "directly_reported",
          "value": "extension",
          "recordedAt": "2026-09-21T12:31:51.980Z",
          "note": "既存の英語版の構造・機能・データ互換性を維持したまま、日本語のUIと質問セットを追加するため。"
        }
      },
      "resolution": {
        "status": "confirmed",
        "value": "extension",
        "decidedByRefs": [
          "participant_3fa593940f374cf2af19"
        ],
        "decisionMethod": "explicit_confirmation",
        "decidedAt": "2026-09-21T12:41:07.281Z"
      },
      "dependencies": [],
      "updatedAt": "2026-09-21T12:42:26.067Z",
      "rationale": "既存の英語版の構造・機能・データ互換性を維持したまま、日本語のUIと質問セットを追加するため。"
    },
    "project.success_evidence": {
      "label": "What observable result would make this release worthwhile?",
      "labelLanguage": "en",
      "category": "project.intent",
      "axis": "fact",
      "kind": "requirement",
      "scope": "project",
      "enforcement": "soft",
      "priority": "must",
      "contributions": {
        "pbc_6b35d18a87d34f37bb84": {
          "perspectiveRef": "participant_3fa593940f374cf2af19",
          "recordedByRef": "participant_3fa593940f374cf2af19",
          "speakingAs": "developer",
          "captureMethod": "direct_input",
          "authority": "decision_owner",
          "confirmation": "directly_reported",
          "value": "日本語利用者が、プロジェクト作成から前提の入力・確認・確定・エクスポートまでを、一連のワークフローとして完了できることを優先する。",
          "recordedAt": "2026-09-21T12:42:33.206Z",
          "note": "初回利用の日本語話者が、ブラウザ翻訳を使わずに、プロジェクト作成から設問の回答または未決定の明示、レビュー、Base確定、Base／Unified JSONおよびAI_CONTEXT.mdのエクスポートまでを完了できる。エクスポートしたJSONを再インポートしても内容が保持される。"
        }
      },
      "resolution": {
        "status": "confirmed",
        "value": "日本語利用者が、プロジェクト作成から前提の入力・確認・確定・エクスポートまでを、一連のワークフローとして完了できることを優先する。",
        "decidedByRefs": [
          "participant_3fa593940f374cf2af19"
        ],
        "decisionMethod": "explicit_confirmation",
        "decidedAt": "2026-09-21T12:42:58.248Z"
      },
      "dependencies": [],
      "updatedAt": "2026-09-21T12:44:01.324Z",
      "acceptanceCriteria": [
        "日本語利用者が、プロジェクト作成から前提の入力・確認・確定・エクスポートまでを、一連のワークフローとして完了できることを優先する。"
      ],
      "rationale": "初回利用の日本語話者が、ブラウザ翻訳を使わずに、プロジェクト作成から設問の回答または未決定の明示、レビュー、Base確定、Base／Unified JSONおよびAI_CONTEXT.mdのエクスポートまでを完了できる。エクスポートしたJSONを再インポートしても内容が保持される。"
    },
    "audience.primary_group": {
      "label": "Who is the primary audience?",
      "labelLanguage": "en",
      "category": "audience.context",
      "axis": "fact",
      "kind": "observation",
      "scope": "project",
      "enforcement": "soft",
      "priority": "must",
      "contributions": {
        "pbc_77338e82535740c596b3": {
          "perspectiveRef": "participant_3fa593940f374cf2af19",
          "recordedByRef": "participant_3fa593940f374cf2af19",
          "speakingAs": "developer",
          "captureMethod": "direct_input",
          "authority": "decision_owner",
          "confirmation": "directly_reported",
          "value": "professionals",
          "recordedAt": "2026-09-21T12:44:03.191Z",
          "note": "主な利用者は、Web制作や小規模Webアプリ開発で要件整理を行う開発者、デザイナー、プロジェクトマネージャー等。依頼者やエンドユーザーへの聞き取り内容を、これらの担当者が代行入力する場合も含む。"
        }
      },
      "resolution": {
        "status": "confirmed",
        "value": "professionals",
        "decidedByRefs": [
          "participant_3fa593940f374cf2af19"
        ],
        "decisionMethod": "explicit_confirmation",
        "decidedAt": "2026-09-21T12:44:32.380Z"
      },
      "dependencies": [],
      "updatedAt": "2026-09-21T12:44:41.804Z",
      "rationale": "主な利用者は、Web制作や小規模Webアプリ開発で要件整理を行う開発者、デザイナー、プロジェクトマネージャー等。依頼者やエンドユーザーへの聞き取り内容を、これらの担当者が代行入力する場合も含む。"
    },
    "audience.relationship": {
      "label": "What relationship will most users have with the project?",
      "labelLanguage": "en",
      "category": "audience.context",
      "axis": "fact",
      "kind": "observation",
      "scope": "project",
      "enforcement": "advisory",
      "priority": "should",
      "contributions": {
        "pbc_157b2e7e8021459abf8e": {
          "perspectiveRef": "participant_3fa593940f374cf2af19",
          "recordedByRef": "participant_3fa593940f374cf2af19",
          "speakingAs": "developer",
          "captureMethod": "direct_input",
          "authority": "decision_owner",
          "confirmation": "directly_reported",
          "value": "first_time_visitors",
          "recordedAt": "2026-09-21T12:45:50.971Z",
          "note": "公開初期は、検索、紹介、GitHubなどから初めて訪れる開発者を主要ケースとする。事前知識がなくても、ツールの目的、ローカル保存の境界、回答からエクスポートまでの流れを理解できるオンボーディングを優先する。既存プロジェクトを再開するリピーターも支援するが、初回理解を妨げない設計とする。"
        }
      },
      "resolution": {
        "status": "confirmed",
        "value": "first_time_visitors",
        "decidedByRefs": [
          "participant_3fa593940f374cf2af19"
        ],
        "decisionMethod": "explicit_confirmation",
        "decidedAt": "2026-09-21T12:46:08.140Z"
      },
      "dependencies": [],
      "updatedAt": "2026-09-21T12:46:14.748Z",
      "rationale": "公開初期は、検索、紹介、GitHubなどから初めて訪れる開発者を主要ケースとする。事前知識がなくても、ツールの目的、ローカル保存の境界、回答からエクスポートまでの流れを理解できるオンボーディングを優先する。既存プロジェクトを再開するリピーターも支援するが、初回理解を妨げない設計とする。"
    },
    "audience.domain_familiarity": {
      "label": "How familiar is the primary audience with the subject?",
      "labelLanguage": "en",
      "category": "audience.context",
      "axis": "fact",
      "kind": "observation",
      "scope": "project",
      "enforcement": "advisory",
      "priority": "should",